{
  "record_type": "observation",
  "record_id": "obs:synthetic-bird-01",
  "source_video_id": "DEMO0000001",
  "source_url": "https://example.invalid/original-demo",
  "evidence_id": "evidence:synthetic-original-bird-frame",
  "access_method": "original_owned",
  "rights_state": "licensed_local_analysis",
  "observed_at": "2026-10-31T00:00:00Z",
  "start_ms": 0,
  "end_ms": 1000,
  "frame_count": 1,
  "source_fps": null,
  "subject": "bird wing",
  "ontology_tags": [
    "animals.birds",
    "geometry.overlap"
  ],
  "literal_observation": "Synthetic drawing features three overlapping feather shapes.",
  "possible_inference": "Overlapping feather groups may improve silhouette readability.",
  "alternative_explanations": "Color contrast could account for apparent detail.",
  "measurements": [],
  "confidence": 0.4,
  "confidence_rationale": "One synthetic still, no motion and no real corpus evidence.",
  "reviewer": "test-fixture",
  "review_state": "draft",
  "synthetic_example": true
}
